<?xml version="1.0" encoding="UTF-8"?>
<?xml-stylesheet type="text/css" href="main.css"?>
<!DOCTYPE studente SYSTEM "es1a.dtd">
<studente matricola="ibml">
    <nominativo>
        <cognome>FUMAGALLI</cognome>
        <nome>DAMIANO</nome>
        <dataNascita>05/05/2002</dataNascita>
    </nominativo>
    <corso annoAccademico="2" link="ibml">
        <nomeCorso></nomeCorso>
        <crediti numero="6" />
        <voto>10</voto>
    </corso>
</studente>